{
  "$schema": "../../standards/schemas/approval-record.v1.schema.json",
  "schemaVersion": "1.0",
  "pageId": "training-plan-detail",
  "status": "approved",
  "contract": {
    "path": "docs/page-specs/training-plan-detail.yaml",
    "revision": 1,
    "digestAlgorithm": "sha256-canonical-json-v1",
    "digest": "6b0a5b30e3d7fa36ea866103e5f18d882e3719cf31ede9dd98b5190ca13141a0"
  },
  "approval": {
    "authority": "human",
    "approvedAt": "2026-09-17T18:48:17+08:00",
    "evidence": "用户已完成培训考试模块第二组页面 review，并在当前会话明确悉予允行，授权完成开发、联调与验收；最终候选已通过三视口视觉复核和生产路由冒烟测试。"
  },
  "scope": {
    "id": "page-content",
    "exceptionRefs": []
  },
  "viewports": ["desktop-1366", "desktop-1440", "desktop-1920"],
  "baselines": [
    {
      "viewportId": "desktop-1366",
      "path": "UIDesign/baselines/training-plan-detail/desktop-1366.png",
      "sha256": "d5756b727ea23ca7af2a721b5fe09224dec504edda8cfda060752bfe84359916"
    },
    {
      "viewportId": "desktop-1440",
      "path": "UIDesign/baselines/training-plan-detail/desktop-1440.png",
      "sha256": "6c2d70d6d718cdd79fdff746c84461f6d175d6ed82b9036359662d720cd1684f"
    },
    {
      "viewportId": "desktop-1920",
      "path": "UIDesign/baselines/training-plan-detail/desktop-1920.png",
      "sha256": "f5db89d0de06ecc7e9c3338c12b187cda6f9a4b9f6225a7058d55ce968344237"
    }
  ],
  "readyText": "培训计划详情"
}
