{
  "$schema": "../../standards/schemas/approval-record.v1.schema.json",
  "schemaVersion": "1.0",
  "pageId": "iam-role-function-permissions",
  "status": "approved",
  "contract": {
    "path": "docs/page-specs/iam-role-function-permissions.yaml",
    "revision": 2,
    "digestAlgorithm": "sha256-canonical-json-v1",
    "digest": "c59af7f3a391e54a3e18a29da4d7c0521d54c26dc3a51898af019424037e41a0"
  },
  "approval": {
    "authority": "human",
    "approvedAt": "2026-09-08T14:52:53+08:00",
    "evidence": "用户在当前会话明确确认：系统与资源、角色管理、功能权限、数据权限、角色分配全部 approved，并要求按最新后端接口完成对接。"
  },
  "scope": {
    "id": "page-content",
    "exceptionRefs": []
  },
  "viewports": ["desktop-1366", "desktop-1440", "desktop-1920"],
  "baselines": [
    {
      "viewportId": "desktop-1366",
      "path": "UIDesign/baselines/iam-role-function-permissions/desktop-1366.png",
      "sha256": "eea6d397edd5c9944dcdab433703aa00732b7bf12d663b6f8defbc6069c6e41f"
    },
    {
      "viewportId": "desktop-1440",
      "path": "UIDesign/baselines/iam-role-function-permissions/desktop-1440.png",
      "sha256": "7f57d30647dc44ad98f23a3805dd262251e33edc39008b13e6ae17b818eeca18"
    },
    {
      "viewportId": "desktop-1920",
      "path": "UIDesign/baselines/iam-role-function-permissions/desktop-1920.png",
      "sha256": "e004d7b2d5f846d2b32b866404ba9f72aa5fcae0b50d465f9674b9ff540c2c3c"
    }
  ],
  "readyText": "功能权限"
}
