{
  "$schema": "../../standards/schemas/approval-record.v1.schema.json",
  "schemaVersion": "1.0",
  "pageId": "training-operations-overview",
  "status": "approved",
  "contract": {
    "path": "docs/page-specs/training-operations-overview.yaml",
    "revision": 2,
    "digestAlgorithm": "sha256-canonical-json-v1",
    "digest": "376b27842c528e5eefc95356eea09ac105da69416ae8240ccc62bb1d7608237c"
  },
  "approval": {
    "authority": "human",
    "approvedAt": "2026-09-17T18:48:17+08:00",
    "evidence": "用户已完成培训考试模块第二组页面 review，并在当前会话明确悉予允行，授权完成开发、联调与验收；最终候选已通过三视口视觉复核和生产路由冒烟测试。"
  },
  "scope": {
    "id": "page-content",
    "exceptionRefs": []
  },
  "viewports": ["desktop-1366", "desktop-1440", "desktop-1920"],
  "baselines": [
    {
      "viewportId": "desktop-1366",
      "path": "UIDesign/baselines/training-operations-overview/desktop-1366.png",
      "sha256": "e499ecb8110fb388e305584dbed16dc4aa2ec152dc2b0dae15b049179626216c"
    },
    {
      "viewportId": "desktop-1440",
      "path": "UIDesign/baselines/training-operations-overview/desktop-1440.png",
      "sha256": "9dd57c770cef074c8de1b25dbcf2c1da88167b82315a00cf10e2ed044b5f2552"
    },
    {
      "viewportId": "desktop-1920",
      "path": "UIDesign/baselines/training-operations-overview/desktop-1920.png",
      "sha256": "e821cb50dcdc66081ff0c93ca264dbe43962673231400b71ee265f00c68f4610"
    }
  ],
  "readyText": "培训概览"
}
