{
  "$schema": "../../standards/schemas/approval-record.v1.schema.json",
  "schemaVersion": "1.0",
  "pageId": "training-question-bank",
  "status": "approved",
  "contract": {
    "path": "docs/page-specs/training-question-bank.yaml",
    "revision": 1,
    "digestAlgorithm": "sha256-canonical-json-v1",
    "digest": "703bed1275acc872723843b6faa1ead96637185b00e7b2140cb427b7fb7d8165"
  },
  "approval": {
    "authority": "human",
    "approvedAt": "2026-09-15T19:15:24+08:00",
    "evidence": "用户在当前会话明确确认：所有页面review通过，请将他们“转正”。本记录对应本次培训资源与考试规则的四个页面，批准现有页面内容、视觉及交互设计；培训业务 API 与权限编码待后续提供。"
  },
  "scope": {
    "id": "page-content",
    "exceptionRefs": []
  },
  "viewports": [
    "desktop-1366",
    "desktop-1440",
    "desktop-1920"
  ],
  "baselines": [
    {
      "viewportId": "desktop-1366",
      "path": "UIDesign/baselines/training-question-bank/desktop-1366.png",
      "sha256": "6cf2cc9c958c004f95865d28fef137da8262814e15a0fbfd3913ee69996c139c"
    },
    {
      "viewportId": "desktop-1440",
      "path": "UIDesign/baselines/training-question-bank/desktop-1440.png",
      "sha256": "6580ba0f40e28560a44903fddfaf08af113ac6b4acc0fa1b6b3fec02e9d23a05"
    },
    {
      "viewportId": "desktop-1920",
      "path": "UIDesign/baselines/training-question-bank/desktop-1920.png",
      "sha256": "ae414eaff23d8675f0ced5959647acf50c2dd197473667ff0e579f9ba80bb7cd"
    }
  ],
  "readyText": "题库管理"
}
