{
  "$schema": "../../standards/schemas/approval-record.v1.schema.json",
  "schemaVersion": "1.0",
  "pageId": "iam-tenant-management",
  "status": "approved",
  "contract": {
    "path": "docs/page-specs/iam-tenant-management.yaml",
    "revision": 3,
    "digestAlgorithm": "sha256-canonical-json-v1",
    "digest": "77018bf70a6a8b1a4f55bb9246692bedea57e7f3e5a4a3b8886f7e70042b3cac"
  },
  "approval": {
    "authority": "human",
    "approvedAt": "2026-09-06T22:06:53+08:00",
    "evidence": "用户在当前会话明确确认：所有页面 approved。"
  },
  "scope": { "id": "page-content", "exceptionRefs": [] },
  "viewports": ["desktop-1366", "desktop-1440", "desktop-1920"],
  "baselines": [
    {
      "viewportId": "desktop-1366",
      "path": "UIDesign/baselines/iam-tenant-management/desktop-1366.png",
      "sha256": "c40dc5eda8016ecaa49f14d9d37a910dbae5af1fda940596f1e4ed0dd3fd45d5"
    },
    {
      "viewportId": "desktop-1440",
      "path": "UIDesign/baselines/iam-tenant-management/desktop-1440.png",
      "sha256": "fa07f508f268c03134d71f1e528ee5723fdb7c399e9d7970adc5a9a974f745f8"
    },
    {
      "viewportId": "desktop-1920",
      "path": "UIDesign/baselines/iam-tenant-management/desktop-1920.png",
      "sha256": "55d3af2f765d7e084b7cc5ecb4d19fb76b051e117e676370987920ead57c9877"
    }
  ],
  "readyText": "Tenant 管理"
}
