{
  "$schema": "../../standards/schemas/approval-record.v1.schema.json",
  "schemaVersion": "1.0",
  "pageId": "training-exam-configuration",
  "status": "approved",
  "contract": {
    "path": "docs/page-specs/training-exam-configuration.yaml",
    "revision": 1,
    "digestAlgorithm": "sha256-canonical-json-v1",
    "digest": "9165a500a24f51cfdb5f4f79b15f6f78a8b72ccc8cd23e97ce8182b8141ba52c"
  },
  "approval": {
    "authority": "human",
    "approvedAt": "2026-09-15T19:15:24+08:00",
    "evidence": "用户在当前会话明确确认：所有页面review通过，请将他们“转正”。本记录对应本次培训资源与考试规则的四个页面，批准现有页面内容、视觉及交互设计；培训业务 API 与权限编码待后续提供。"
  },
  "scope": {
    "id": "page-content",
    "exceptionRefs": []
  },
  "viewports": [
    "desktop-1366",
    "desktop-1440",
    "desktop-1920"
  ],
  "baselines": [
    {
      "viewportId": "desktop-1366",
      "path": "UIDesign/baselines/training-exam-configuration/desktop-1366.png",
      "sha256": "e5fab0451bd6dda610c107f95f3a4961804724c4b74d3d536f90e8fb697ade1b"
    },
    {
      "viewportId": "desktop-1440",
      "path": "UIDesign/baselines/training-exam-configuration/desktop-1440.png",
      "sha256": "531c5323473fce26b5ab57e12eeae09d4818a6ecc5467fc869b401e44525b800"
    },
    {
      "viewportId": "desktop-1920",
      "path": "UIDesign/baselines/training-exam-configuration/desktop-1920.png",
      "sha256": "f2956276496ea7c2b02710fc0f0fee4c83af694aac093954548c1e1a49e23b55"
    }
  ],
  "readyText": "考试配置管理"
}
