{
  "$schema": "../../standards/schemas/approval-record.v1.schema.json",
  "schemaVersion": "1.0",
  "pageId": "iam-password-recovery",
  "status": "approved",
  "contract": {
    "path": "docs/page-specs/iam-password-recovery.yaml",
    "revision": 1,
    "digestAlgorithm": "sha256-canonical-json-v1",
    "digest": "e1be7776188477277195b16dec123763a1f07b397465a4ae7110032d81cd2591"
  },
  "approval": {
    "authority": "human",
    "approvedAt": "2026-09-04T17:06:14+08:00",
    "evidence": "用户在当前会话明确指令：approved"
  },
  "scope": {
    "id": "page-content",
    "exceptionRefs": ["standalone-auth-surface"]
  },
  "viewports": ["desktop-1366", "desktop-1440", "desktop-1920"],
  "baselines": [
    {
      "viewportId": "desktop-1366",
      "path": "UIDesign/baselines/iam-password-recovery/desktop-1366.png",
      "sha256": "7e05c22259cee6529502c3e150a60b00d9aca975bf57d80c903c3340524bf53a"
    },
    {
      "viewportId": "desktop-1440",
      "path": "UIDesign/baselines/iam-password-recovery/desktop-1440.png",
      "sha256": "f0fc2ab97d5daebffb954385463213f042ef1e4090a566c1852659473e7f17a5"
    },
    {
      "viewportId": "desktop-1920",
      "path": "UIDesign/baselines/iam-password-recovery/desktop-1920.png",
      "sha256": "c391f2a067725abbe6af6b2ca095de48927b0add08f8e0acbe1ef411629ce993"
    }
  ],
  "readyText": "忘记密码？"
}
