{
  "$schema": "../../standards/schemas/approval-record.v1.schema.json",
  "schemaVersion": "1.0",
  "pageId": "training-plan-management",
  "status": "approved",
  "contract": {
    "path": "docs/page-specs/training-plan-management.yaml",
    "revision": 2,
    "digestAlgorithm": "sha256-canonical-json-v1",
    "digest": "67123dbf3f1e279fc071cce4ccb63273f069009a11909c63be72c5dae4173be0"
  },
  "approval": {
    "authority": "human",
    "approvedAt": "2026-09-17T18:48:17+08:00",
    "evidence": "用户已完成培训考试模块第二组页面 review，并在当前会话明确悉予允行，授权完成开发、联调与验收；最终候选已通过三视口视觉复核和生产路由冒烟测试。"
  },
  "scope": {
    "id": "page-content",
    "exceptionRefs": []
  },
  "viewports": ["desktop-1366", "desktop-1440", "desktop-1920"],
  "baselines": [
    {
      "viewportId": "desktop-1366",
      "path": "UIDesign/baselines/training-plan-management/desktop-1366.png",
      "sha256": "a6587fc94ae0952bc89d625b3bce684037e7650361235e385259bc02ab8f1e1e"
    },
    {
      "viewportId": "desktop-1440",
      "path": "UIDesign/baselines/training-plan-management/desktop-1440.png",
      "sha256": "5055f77a61607e2c84d4aa1c8473ebbed347c92860c0b3539a2ae266a1ba5bf0"
    },
    {
      "viewportId": "desktop-1920",
      "path": "UIDesign/baselines/training-plan-management/desktop-1920.png",
      "sha256": "34c16d6ed36e4e611c79ceb298438f9bb8127590326695944b199b8baacd3a8d"
    }
  ],
  "readyText": "培训计划"
}
