{
  "$schema": "../../standards/schemas/approval-record.v1.schema.json",
  "schemaVersion": "1.0",
  "pageId": "iam-role-data-permissions",
  "status": "approved",
  "contract": {
    "path": "docs/page-specs/iam-role-data-permissions.yaml",
    "revision": 2,
    "digestAlgorithm": "sha256-canonical-json-v1",
    "digest": "2d1a1c179a8790b32a546be446f1af6184cdbf5b356d35dbe812f0141df3a6f3"
  },
  "approval": {
    "authority": "human",
    "approvedAt": "2026-09-08T14:52:53+08:00",
    "evidence": "用户在当前会话明确确认：系统与资源、角色管理、功能权限、数据权限、角色分配全部 approved，并要求按最新后端接口完成对接。"
  },
  "scope": {
    "id": "page-content",
    "exceptionRefs": []
  },
  "viewports": ["desktop-1366", "desktop-1440", "desktop-1920"],
  "baselines": [
    {
      "viewportId": "desktop-1366",
      "path": "UIDesign/baselines/iam-role-data-permissions/desktop-1366.png",
      "sha256": "eaa35f9169b0b4988e007e5f178597d269d118f3484d54c4d5cd80e6d188a285"
    },
    {
      "viewportId": "desktop-1440",
      "path": "UIDesign/baselines/iam-role-data-permissions/desktop-1440.png",
      "sha256": "ac2ac7c7f766f1663fb6f1f37607b6a78efa0903ba7e62f9ab673952589d2d05"
    },
    {
      "viewportId": "desktop-1920",
      "path": "UIDesign/baselines/iam-role-data-permissions/desktop-1920.png",
      "sha256": "dfdf7fbc1dd08c1cd31bf4cfe1fad57581d157551c743d41d7a8d2a8a1f643b4"
    }
  ],
  "readyText": "数据权限"
}
