{
  "$schema": "../../standards/schemas/approval-record.v1.schema.json",
  "schemaVersion": "1.0",
  "pageId": "iam-login",
  "status": "approved",
  "contract": {
    "path": "docs/page-specs/iam-login.yaml",
    "revision": 3,
    "digestAlgorithm": "sha256-canonical-json-v1",
    "digest": "01e871106540839b73bc8aab50768b6f63029a8cb82bd4f6429b62daaed1afc3"
  },
  "approval": {
    "authority": "human",
    "approvedAt": "2026-09-05T01:43:01+08:00",
    "evidence": "用户先明确批准登录页 Candidate（approved！），随后提供 IAM Login 接口并要求完成正式页面；本次又明确允许 INITIAL_PASSWORD_CHANGE_REQUIRED 暂时进入框架欢迎页且不开发改密功能。登录页 Canonical 视觉与三视口批准基线均未改变。"
  },
  "scope": {
    "id": "page-content",
    "exceptionRefs": ["standalone-auth-surface"]
  },
  "viewports": ["desktop-1366", "desktop-1440", "desktop-1920"],
  "baselines": [
    {
      "viewportId": "desktop-1366",
      "path": "UIDesign/baselines/iam-login/desktop-1366.png",
      "sha256": "3192b008a0d7840e8071bf79e3dd6d482bb46028538530119755422078e6d6fa"
    },
    {
      "viewportId": "desktop-1440",
      "path": "UIDesign/baselines/iam-login/desktop-1440.png",
      "sha256": "eba28a979add123d7b1ebed67d3b408e0424554374aab154ac717ca7d883d651"
    },
    {
      "viewportId": "desktop-1920",
      "path": "UIDesign/baselines/iam-login/desktop-1920.png",
      "sha256": "86d6470acd645c178a47f29c8c847d472f3e94eb6e2e5a90668e9b2e95393e9d"
    }
  ],
  "readyText": "登录陆链控制台"
}
