{
  "$schema": "../../standards/schemas/approval-record.v1.schema.json",
  "schemaVersion": "1.0",
  "pageId": "training-paper-management",
  "status": "approved",
  "contract": {
    "path": "docs/page-specs/training-paper-management.yaml",
    "revision": 1,
    "digestAlgorithm": "sha256-canonical-json-v1",
    "digest": "f3a4bf222440ad0bd85f7a0a042406dd2170bbf75876ff9850fc9f4815344049"
  },
  "approval": {
    "authority": "human",
    "approvedAt": "2026-09-15T19:15:24+08:00",
    "evidence": "用户在当前会话明确确认：所有页面review通过，请将他们“转正”。本记录对应本次培训资源与考试规则的四个页面，批准现有页面内容、视觉及交互设计；培训业务 API 与权限编码待后续提供。"
  },
  "scope": {
    "id": "page-content",
    "exceptionRefs": []
  },
  "viewports": [
    "desktop-1366",
    "desktop-1440",
    "desktop-1920"
  ],
  "baselines": [
    {
      "viewportId": "desktop-1366",
      "path": "UIDesign/baselines/training-paper-management/desktop-1366.png",
      "sha256": "5b637fb63fe80e6d2ec3a116b51d91ccbb5c72743be48636dbf065887f7b1fd6"
    },
    {
      "viewportId": "desktop-1440",
      "path": "UIDesign/baselines/training-paper-management/desktop-1440.png",
      "sha256": "289f85faa8876eb41a50f1f9f1c2ab6b65d916be42c47667bf1fadfb8a88fe2b"
    },
    {
      "viewportId": "desktop-1920",
      "path": "UIDesign/baselines/training-paper-management/desktop-1920.png",
      "sha256": "d73ba1c15ff2291ae2764facddb3cf47995bbfce657ecb5112cb4e935699c22a"
    }
  ],
  "readyText": "试卷管理"
}
