{
  "$schema": "../../standards/schemas/approval-record.v1.schema.json",
  "schemaVersion": "1.0",
  "pageId": "training-task-detail",
  "status": "approved",
  "contract": {
    "path": "docs/page-specs/training-task-detail.yaml",
    "revision": 1,
    "digestAlgorithm": "sha256-canonical-json-v1",
    "digest": "eadd84de85aaffffe3eee171320d8dafb3d7130ca821de189d053defb0f7e9b0"
  },
  "approval": {
    "authority": "human",
    "approvedAt": "2026-09-17T18:48:17+08:00",
    "evidence": "用户已完成培训考试模块第二组页面 review，并在当前会话明确悉予允行，授权完成开发、联调与验收；最终候选已通过三视口视觉复核和生产路由冒烟测试。"
  },
  "scope": {
    "id": "page-content",
    "exceptionRefs": []
  },
  "viewports": ["desktop-1366", "desktop-1440", "desktop-1920"],
  "baselines": [
    {
      "viewportId": "desktop-1366",
      "path": "UIDesign/baselines/training-task-detail/desktop-1366.png",
      "sha256": "d95479b7ece0af53680e9abbb83b9d2f50612969a39d922194b8098ca48f15e3"
    },
    {
      "viewportId": "desktop-1440",
      "path": "UIDesign/baselines/training-task-detail/desktop-1440.png",
      "sha256": "05fd8a0d7618114a4f5c1ae6307eae8dccc8139a92478307042b7fa1c7bc09f6"
    },
    {
      "viewportId": "desktop-1920",
      "path": "UIDesign/baselines/training-task-detail/desktop-1920.png",
      "sha256": "41579f8131a37ca0d13bdb67bd39a861186c57c043708bcf0f6ff1db6ded0374"
    }
  ],
  "readyText": "培训任务详情"
}
